{"schemaVersion":"mana.context-runtime.context-manifest/v1","executionId":"execution-fixture","profileId":"fixture-profile","activationMode":"declarative","semanticAgents":["fixture-agent"],"declaredCandidateSkills":["database-risk","risk-classifier","source-review"],"baselineSkills":["risk-classifier"],"staticallyActivatedSkills":[{"signal":"application_code_change","skill":"source-review"}],"semanticallyRequestedSkills":[],"activatedSkills":[{"id":"risk-classifier","reason":"baseline","activationSignal":null,"modelTier":"economy","riskLevel":"low","executionMode":"read","delegationGroup":"source","parallelSafe":true},{"id":"source-review","reason":"static-signal","activationSignal":"application_code_change","modelTier":"economy","riskLevel":"medium","executionMode":"read","delegationGroup":"source","parallelSafe":true}],"deepLoadedSkills":[{"id":"source-review","instructionPath":"skills/source-review/SKILL.md"}],"inactiveSkills":["database-risk"],"availableConditionalSkills":[{"signal":"migration_or_schema_change","skill":"database-risk"}],"modelEscalationSkills":[],"writePermissionRequirements":[],"requiredArtifacts":["fixture-report.md"],"limits":{"directWorkers":2,"workerDepth":0,"retrievalCyclesPerQuestion":3},"warnings":[]}
